id,location,session,age_group,age,sex,lp,date_test,test_language,list,version,doe_english,doe_catalan,doe_spanish,doe_others,id_vocab,id_session,comments
30458,Oxford,1,30 months,30.29158110882957,m,Monolingual (English),2021-11-29,English,1,British,1,0,0,0,EX01UK01ML041,30458,"Good! Occasionally looked a bit uninterested. Seemed to slide down a bit in his mum's arms so possibly not in the right position all the time (also, sometimes sitting a bit on the left side)"
30459,Oxford,1,30 months,30.127310061601644,m,Monolingual (English),2021-11-29,English,2,British,1,0,0,0,EX01UK01ML042,30459,Very good! Towards the end a tiny bit restless. Coughing occasionally
30460,Oxford,1,30 months,30.751540041067763,m,Monolingual (English),2021-12-02,English,3,British,1,0,0,0,EX01UK01ML043,30460,"V good! Didn't move, very focused. Calibration not perfect, but ok"
30461,Oxford,1,30 months,30.55441478439425,m,Monolingual (English),2021-12-06,English,4,British,1,0,0,0,EX01UK01ML044,30461,"1st: v good; 2nd: moving his head occasionally, but overall good!; had a break before the 3rd part: rubbing a bit his eyes during the last part and losing a bit his patience, but still good."
30462,Oxford,1,30 months,30.390143737166323,m,Monolingual (English),2021-12-16,English,1,British,1,0,0,0,EX01UK01ML045,30462,"Good. Sat through CP and BSI, moved position and turned around to look at mother sometimes. Did not finish preference"
30463,Oxford,1,30 months,32,f,Monolingual (English),2021-12-03,English,2,British,1,0,0,0,EX01UK01ML046,30463,V good! Towards the end (preference task) started losing her patience a bit
30464,Oxford,1,30 months,31.277207392197127,m,Monolingual (English),2021-12-07,English,3,British,1,0,0,0,EX01UK01ML047,30464,"calibration a bit tricky as he kept leaning back or leaning towards the screen (ran it several times both before CP and BSI); during the study he was mostly sitting still; he was naming ALL the pictures on the screen; during CP, after 12 trials they had to go for a wee break - continued aftewards from where we stopped - hopefully still in the right position."
30465,Oxford,1,30 months,32.558521560574945,f,Monolingual (English),2021-12-13,English,4,British,1,0,0,0,EX01UK01ML049,30465,"Very good. Turned around to look at mother a few times, and mother readjusted when position slid down, but otherwise attentive and didn't move much"
30466,Oxford,1,30 months,30.55441478439425,f,Monolingual (English),2021-12-14,English,1,British,1,0,0,0,EX01UK01ML050,30466,"Good. Sat through CP and BSI, had to be readjusted a few times because child started leaning back. Did not finish preference"
30467,Oxford,1,30 months,30.62012320328542,f,Monolingual (English),2022-01-13,English,2,British,1,0,0,0,EX01UK01ML051,30467,"V good for BSI and CP, just from time to time saying something to her mum; for the preference task: rubbing a bit her eyes, touching her nose, overall a bit less interested"
30468,Oxford,1,30 months,30.2258726899384,m,Monolingual (English),2022-01-13,English,3,British,1,0,0,0,EX01UK01ML052,30468,"sat through CP, mostly focused; stopped around halfway for BSI"
30469,Oxford,1,30 months,30.652977412731005,f,Monolingual (English),2022-01-14,English,4,British,1,0,0,0,EX01UK01ML053,30469,"repeated all the words that she heard throughout the 2 studies; calibration not perfect because she was either looking away or leaning forwards (ran it several times for each study - she was in the right position); overall good, although the leaning could be a bit of an issue; from CP block 1 trial 12 onwards it was very good."
30470,Oxford,1,30 months,30.94866529774127,m,Monolingual (English),2022-01-22,English,2,British,1,0,0,0,EX01UK01ML055,30470,"very good, sat through all the tasks, named most pictures (didn't recognise leather jacket, called boots ""daddy's shoe"")"
30471,Oxford,1,30 months,30.94866529774127,m,Monolingual (English),2022-01-22,English,1,British,1,0,0,0,EX01UK01ML054,30471,"very good, sat through all the tasks, only looking away between trials occasionally - named pictures at beginning of task"
30472,Oxford,1,30 months,29.864476386036962,m,Monolingual (English),2022-01-17,English,3,British,1,0,0,0,EX01UK01ML056,30472,finished most of CP without moving position much (looked around occasionally). Did not complete last 3-4 trials and refused to continue to BSI
30475,Oxford,1,30 months,29.930184804928132,m,Monolingual (English),2022-02-07,English,4,British,1,0,0,0,EX01UK01ML060,30475,overall v good! BS: naming some of the pictures; CP: trying to name all the pictures (almost like a game); preference: naming pictures from time to time
30476,Oxford,1,30 months,31.704312114989733,m,Monolingual (English),2022-02-08,English,1,British,1,0,0,0,EX01UK01ML061,30476,"(occasional few words in Vietnamese from mum) v good for both! For CP kept asking ""why does it say x?"" didn't run the preference task because he wanted to stop"
30477,Oxford,1,30 months,30.850102669404517,f,Monolingual (English),2022-03-18,English,2,British,1,0,0,0,EX01UK01ML064,30477,"v good! For BSI repeated the words for the first couple of trials; looked a bit sad/worried towards the end, but very focused during both studies; after CP she said she wants to finish"
30478,Oxford,1,30 months,29.73305954825462,m,Monolingual (English),2022-03-25,English,3,British,1,0,0,0,EX01UK01ML068,30478,"v good; CP: leaned back during the second part but position was still good; rubbing his nose during a few trials; BSI: half way through wanted to get off, but stayed until the end"
30479,Oxford,1,30 months,29.9958932238193,f,Monolingual (English),2022-03-26,English,4,British,1,0,0,0,EX01UK01ML069,30479,"Sat well throughout. Looked away for a handful of trials, but did rub her eyes a few times"
30480,Oxford,1,30 months,29.79876796714579,m,Monolingual (English),2022-03-28,English,1,British,1,0,0,0,EX01UK01ML071,30480,"CP: looking up in the beginning and then again a couple of times more during the study + turning towards his mum a couple of times; a bit fidgety towards the end, but good overall! BS: v good, shaking his head during some trials, during the second half; preference: said he wanted to get off, but stayed and watched until the end; named some of the pictures; changed position quite a bit, so at times may have been sitting too close or too low"
30481,Oxford,1,30 months,30.357289527720738,f,Monolingual (English),2022-04-12,English,4,British,1,0,0,0,EX01UK01ML075,30481,to be rescheduled? (unwell)
30482,Oxford,1,30 months,30.42299794661191,m,Monolingual (English),2022-03-30,English,3,British,1,0,0,0,EX01UK01ML072,30482,"Session run in the Green Room! Good for CP and BSI, but tended to slide down all the time; his mum would pull him back up every time, but that meant the position changed quite a bit throughout the studies; for CP he was repeating most of the target words; for BSI playing a bit w/ his lips/nose; preference: getting tired, rubbing his eyes"
30483,Oxford,1,30 months,29.9958932238193,m,Monolingual (English),2022-04-07,English,2,British,1,0,0,0,EX01UK01ML079,30483,"very good, completed all tasks. Was leaning closer to mother during BSI compared to calibration, but returned to upright seated position for CP and preference. Looked away at the beginning of some trials towards mother but returned to screen after trial start. Did not have sound through headphones (audio in room was fine) but looked like he was naming some pictures (large productive vocabulary)"
30484,Oxford,1,30 months,30.094455852156056,m,Monolingual (English),2022-04-12,English,4,British,1,0,0,0,EX01UK01ML080,30484,"v good, repeating some of the words occasionally (only exception was half way through CP when he got restless during a couple of trials, as he wanted to get off, but then he was happy to sit until the end)"
30486,Oxford,1,30 months,30.652977412731005,m,Monolingual (English),2022-04-28,English,2,British,1,0,0,0,EX01UK01ML082,30486,"(lights on) BSI: good! During the first half was constantly turning around, as if not understanding where the sound comes from; mum was talking to him; CP: v good; repeating/naming many of the stimuli"
30488,Oxford,1,30 months,30.094455852156056,f,Monolingual (English),2022-05-12,English,4,British,1,0,0,0,EX01UK01ML083,30488,"v good! v focused and interested; for CP, at some point half-way through, started naming/repeating some of the stimuli"
30500,Oxford,1,30 months,30.718685831622178,m,Monolingual (English),2021-11-24,English,2,British,1,0,0,0,EX01UK01ML036,30500,"Exclude. Unable to calibrate. Has glue ear (hearing aid) and cataract (lens). Knows very few words, does not speak"
30552,Oxford,1,30 months,32.13141683778234,m,Monolingual (English),2021-11-25,English,3,British,1,0,0,0,R_1IfU918u4rEzATj,30552,"Very good, relaxed and looked at screen most of the time. Only turned up to look at mum a couple of times between trials"
